{
  "command": [
    "python3",
    "/home/user/taehyeon/train_lora_a.py",
    "--model",
    "Qwen/Qwen3-8B",
    "--data_dir",
    "/home/openit/taehyeon/data/dataset_10_14",
    "--prefix",
    "lora_a",
    "--out_dir",
    "/home/user/sdabin/healthKiosk/model-lab/runs/train/lora_a_8b_v2/adapter",
    "--lr",
    "0.0002",
    "--epochs",
    "3",
    "--batch",
    "2",
    "--accum",
    "4",
    "--max_len",
    "4096",
    "--seed",
    "42",
    "--rank",
    "16",
    "--alpha",
    "16",
    "--dropout",
    "0.0",
    "--eval_steps",
    "50"
  ],
  "command_line": "python3 /home/user/taehyeon/train_lora_a.py --model Qwen/Qwen3-8B --data_dir /home/openit/taehyeon/data/dataset_10_14 --prefix lora_a --out_dir /home/user/sdabin/healthKiosk/model-lab/runs/train/lora_a_8b_v2/adapter --lr 0.0002 --epochs 3 --batch 2 --accum 4 --max_len 4096 --seed 42 --rank 16 --alpha 16 --dropout 0.0 --eval_steps 50",
  "config_hash": "sha256:f326d62cc77f5cc32272bb1fc3b5308f9b88eddfd9499d1d8ea606505e7df0dc",
  "cwd": "/home/user/taehyeon",
  "expected_adapter_dir": "/home/user/sdabin/healthKiosk/model-lab/runs/train/lora_a_8b_v2/adapter",
  "expected_files": [
    "adapter_model.safetensors",
    "adapter_config.json"
  ],
  "notes": [],
  "record_file": "/home/user/sdabin/healthKiosk/model-lab/runs/train/lora_a_8b_v2/adapter.train-wrap.json",
  "role": "LORA_A"
}